Here is imapsync 2.290 on host MacBook-Pro-de-Tomas.local, a darwin system with 0.1/8.0 free GiB of RAM, 70.20% used by processes.
with Perl 5.34.1 and Mail::IMAPClient 3.43
Transfer started at Tuesday 26 August 2025-08-26 15:17:33 -0400 -04
PID is 19181 my PPID is 14112
Log file is LOG_imapsync/2025_08_26_15_17_33_800_tomas_patriciastocker_com_tomas_patriciastocker_com.txt ( to change it, use --logfile path ; or use --nolog to turn off logging )
Load is 2.35 2.19 2.55 on 8 cores
Real user id is a1234 (uid 501)
Effective user id is a1234 (euid 501)
$RCSfile: imapsync,v $ $Revision: 2.290 $ $Date: 2024/08/20 10:37:23 $ 
Command line used, run by /usr/bin/perl5.34:
/opt/homebrew/Cellar/imapsync/2.290_1/libexec/bin/imapsync --host1 patriciastocker.com --user1 tomas@patriciastocker.com --password1 MASKED --port1 993 --ssl1 --host2 imap.hostinger.com --user2 tomas@patriciastocker.com --password2 MASKED --port2 993 --ssl2 --syncinternaldates --exclude Junk|spam --automap
Current directory is /Users/a1234/Desktop/Patricia-Stocker/patricia-stocker-intranet
Temp directory is /Users/a1234/tmp ( to change it use --tmpdir dirpath )
Creating temp directory /Users/a1234/tmp
kill -QUIT 19181 # special behavior: call to sub catch_exit
kill -TERM 19181 # special behavior: call to sub catch_exit
kill -INT 19181 # special behavior: call to sub catch_reconnect
kill -HUP 19181 # special behavior: call to sub catch_print
kill -USR1 19181 # special behavior: call to sub toggle_sleep
Logging to a logfile by default. To turn off logging, use --nolog
File /Users/a1234/tmp/imapsync.pid does not exist
PID file is /Users/a1234/tmp/imapsync.pid ( to change it, use --pidfile filepath ; to avoid it use --pidfile "" )
Writing my PID 19181 in /Users/a1234/tmp/imapsync.pid
Writing also my logfile name in /Users/a1234/tmp/imapsync.pid : LOG_imapsync/2025_08_26_15_17_33_800_tomas_patriciastocker_com_tomas_patriciastocker_com.txt
Modules version list ( use --no-modulesversion to turn off printing this Perl modules list ):
Authen::NTLM         1.09
CGI                  4.48
Compress::Zlib       2.102
Crypt::OpenSSL::RSA  0.31
Digest::HMAC_MD5     1.01
Digest::HMAC_SHA1    1.03
Digest::MD5          2.58
Digest::SHA          6.02
Encode               3.0801
Encode::IMAPUTF7     1.05
File::Copy::Recursive 0.45
File::Spec           3.80
Getopt::Long         2.52
HTML::Entities       3.69
IO::Socket           1.46
IO::Socket::INET     1.46
IO::Socket::INET6    2.72
IO::Socket::IP       0.42
IO::Socket::SSL      2.068
IO::Tee              0.65
JSON                 4.10
JSON::WebToken       0.10
LWP                  6.44
MIME::Base64         3.16
Mail::IMAPClient     3.43
Net::Ping            2.74
Net::SSLeay          1.88
Term::ReadKey        2.38
Test::MockObject     1.20200122
Time::HiRes          1.9767
Unicode::String      2.10

Info: will resync flags for already transferred messages. Use --noresyncflags to not resync flags.
SSL debug mode level is --debugssl 1 (can be set from 0 meaning no debug to 4 meaning max debug)
Host1: SSL default mode is like --sslargs1 "SSL_verify_mode=0", meaning for host1 SSL_VERIFY_NONE, ie, do not check the server certificate.
Host1: Use --sslargs1 SSL_verify_mode=1 to have SSL_VERIFY_PEER, ie, check the server certificate. of host1
Host2: SSL default mode is like --sslargs2 "SSL_verify_mode=0", meaning for host2 SSL_VERIFY_NONE, ie, do not check the server certificate.
Host2: Use --sslargs2 SSL_verify_mode=1 to have SSL_VERIFY_PEER, ie, check the server certificate. of host2
Info: turned ON syncinternaldates, will set the internal dates (arrival dates) on host2 same as host1.
Host1: will try to use LOGIN authentication on host1
Host2: will try to use LOGIN authentication on host2
Host1: imap connection timeout is 120 seconds
Host2: imap connection timeout is 120 seconds
Host1: imap connection keepalive is on on host1. Use --nokeepalive1 to disable it.
Host2: imap connection keepalive is on on host2. Use --nokeepalive2 to disable it.
Host1: IMAP server [patriciastocker.com] port [993] user [tomas@patriciastocker.com]
Host2: IMAP server [imap.hostinger.com] port [993] user [tomas@patriciastocker.com]
Host1: connecting and login on host1 [patriciastocker.com] port [993] with user [tomas@patriciastocker.com]
DEBUG: .../IO/Socket/SSL.pm:1177: global error: Undefined SSL object
DEBUG: .../IO/Socket/SSL.pm:1177: global error: Undefined SSL object
Host1 IP address: 45.239.218.18 Local IP address: 192.168.1.20
Host1 banner: * OK [CAPABILITY IMAP4rev1 SASL-IR LOGIN-REFERRALS ID ENABLE IDLE NAMESPACE LITERAL+ AUTH=PLAIN AUTH=LOGIN] Dovecot ready.
Host1 capability before authentication: IMAP4rev1 SASL-IR LOGIN-REFERRALS ID ENABLE IDLE NAMESPACE LITERAL+ AUTH=PLAIN AUTH=LOGIN AUTH
Host1: patriciastocker.com says it has CAPABILITY for AUTHENTICATE LOGIN
Host1: success login on [patriciastocker.com] with user [tomas@patriciastocker.com] auth [LOGIN] or [LOGIN]
Host2: connecting and login on host2 [imap.hostinger.com] port [993] with user [tomas@patriciastocker.com]
DEBUG: .../IO/Socket/SSL.pm:1177: global error: Undefined SSL object
DEBUG: .../IO/Socket/SSL.pm:1177: global error: Undefined SSL object
Host2 IP address: 172.65.188.64 Local IP address: 192.168.1.20
Host2 banner: * OK [CAPABILITY IMAP4rev1 SASL-IR LOGIN-REFERRALS ID ENABLE IDLE LITERAL+ AUTH=PLAIN AUTH=LOGIN] Server ready.
Host2 capability before authentication: IMAP4rev1 SASL-IR LOGIN-REFERRALS ID ENABLE IDLE LITERAL+ AUTH=PLAIN AUTH=LOGIN AUTH
Host2: imap.hostinger.com says it has CAPABILITY for AUTHENTICATE LOGIN
Host2: success login on [imap.hostinger.com] with user [tomas@patriciastocker.com] auth [LOGIN] or [LOGIN]
Host1: state Authenticated
Host2: state Authenticated
Host1 capability once authenticated: IMAP4rev1 SASL-IR LOGIN-REFERRALS ID ENABLE IDLE SORT SORT=DISPLAY THREAD=REFERENCES THREAD=REFS THREAD=ORDEREDSUBJECT MULTIAPPEND URL-PARTIAL CATENATE UNSELECT CHILDREN NAMESPACE UIDPLUS LIST-EXTENDED I18NLEVEL=1 CONDSTORE QRESYNC ESEARCH ESORT SEARCHRES WITHIN CONTEXT=SEARCH LIST-STATUS BINARY MOVE SNIPPET=FUZZY PREVIEW=FUZZY PREVIEW STATUS=SIZE SAVEDATE NAMESPACE LITERAL+ NOTIFY SPECIAL-USE COMPRESS=DEFLATE QUOTA THREAD I18NLEVEL CONTEXT SNIPPET PREVIEW STATUS COMPRESS
Host2 capability once authenticated: IMAP4rev1 SASL-IR LOGIN-REFERRALS ID ENABLE IDLE SORT SORT=DISPLAY THREAD=REFERENCES THREAD=REFS THREAD=ORDEREDSUBJECT MULTIAPPEND URL-PARTIAL CATENATE UNSELECT CHILDREN NAMESPACE UIDPLUS LIST-EXTENDED I18NLEVEL=1 CONDSTORE QRESYNC ESEARCH ESORT SEARCHRES WITHIN CONTEXT=SEARCH LIST-STATUS BINARY MOVE SNIPPET=FUZZY PREVIEW=FUZZY PREVIEW STATUS=SIZE SAVEDATE LITERAL+ NOTIFY SPECIAL-USE COMPRESS=DEFLATE QUOTA THREAD I18NLEVEL CONTEXT SNIPPET PREVIEW STATUS COMPRESS
Host1: found ID capability. Sending/receiving ID, presented in raw IMAP for now.
In order to avoid sending/receiving ID, use option --noid
Sending: 4 ID ("name" "imapsync" "version" "2.290" "os" "darwin" "vendor" "Gilles LAMIRAL" "support-url" "https://imapsync.lamiral.info/" "date" "20-Aug-2024 10:37:23 +0000" "side" "host1")
Sent 182 bytes
Read: 	* ID ("name" "Dovecot")
  	4 OK ID completed (0.001 + 0.000 secs).
Host2: found ID capability. Sending/receiving ID, presented in raw IMAP for now.
In order to avoid sending/receiving ID, use option --noid
Sending: 4 ID ("name" "imapsync" "version" "2.290" "os" "darwin" "vendor" "Gilles LAMIRAL" "support-url" "https://imapsync.lamiral.info/" "date" "20-Aug-2024 10:37:23 +0000" "side" "host2")
Sent 182 bytes
Read: 	* ID ("name" "Dovecot")
  	4 OK ID completed (0.001 + 0.000 secs).

Host2: QUOTA capability found, presented in raw IMAP on next lines
Sending: 5 GETQUOTAROOT INBOX
Sent 22 bytes
Read: 	* QUOTAROOT INBOX "Storage quota"
  	* QUOTA "Storage quota" (STORAGE 53 10485760 MESSAGE 8 100000)
  	5 OK Getquotaroot completed (0.060 + 0.000 + 0.059 secs).

Host2: Quota current storage is 54272 bytes. Limit is 10737418240 bytes. So 0.00 % full
Host1: Compression is off. Use --compress1 to allow compression on host1
Host2: Compression is off. Use --compress2 to allow compression on host2
Compression often generates annoying errors, especially with SSL connexions, Gmail, Office365. So, avoid it.
Host1: found 7 folders.
Host2: found 5 folders.
Host1: guessing separator from folder listing: [.]
Host1: separator given by NAMESPACE: [.]
Host2: guessing separator from folder listing: [.]
Host2: separator given by NAMESPACE: [.]
Host1: guessing prefix from folder listing: [INBOX.]
Host1: prefix given by NAMESPACE: [INBOX.]
Host2: guessing prefix from folder listing: [INBOX.]
Host2: prefix given by NAMESPACE: [INBOX.]
Host1: separator and prefix: [.][INBOX.]
Host2: separator and prefix: [.][INBOX.]
Including all folders found by default. Use --subscribed or --folder or --folderrec or --include to select specific folders. Use --exclude to unselect specific folders.
Excluding folders matching pattern Junk|spam
[INBOX.Junk]
[INBOX.spam]

Host1: Checking wanted folders exist. Use --nocheckfoldersexist to avoid this check (shared of public namespace targeted).
Host1: Checking wanted folders are selectable. Use --nocheckselectable to avoid this check.
Turned on automapping folders ( use --noautomap to turn off automapping )
Host1: special INBOX.Archive        = \Archive
Host1: special INBOX.spam           = \Junk
Host1: special INBOX.Trash          = \Trash
Host1: special INBOX.Sent           = \Sent
Host1: special INBOX.Drafts         = \Drafts

Host2: special INBOX.Trash          = \Trash
Host2: special INBOX.Junk           = \Junk
Host2: special INBOX.Sent           = \Sent
Host2: special INBOX.Drafts         = \Drafts


++++ Listing folders
All foldernames are presented between brackets like [X] where X is the foldername.
When a foldername contains non-ASCII characters it is presented in the form
[X] = [Y] where
X is the imap foldername you have to use in command line options and
Y is the utf8 output just printed for convenience, to recognize it.

Host1: folders list (first the raw imap format then the [X] = [Y]):
* LIST (\HasChildren) "." INBOX
* LIST (\HasNoChildren \Archive) "." INBOX.Archive
* LIST (\HasNoChildren \Junk) "." INBOX.spam
* LIST (\HasNoChildren \Trash) "." INBOX.Trash
* LIST (\HasNoChildren \UnMarked \Sent) "." INBOX.Sent
* LIST (\HasNoChildren) "." INBOX.Junk
* LIST (\HasNoChildren \UnMarked \Drafts) "." INBOX.Drafts
15 OK List completed (0.001 + 0.000 secs).

[INBOX]
[INBOX.Archive]
[INBOX.Drafts]
[INBOX.Junk]
[INBOX.Sent]
[INBOX.Trash]
[INBOX.spam]

Host2: folders list (first the raw imap format then the [X] = [Y]):
* LIST (\HasChildren) "." INBOX
* LIST (\HasNoChildren \Trash) "." INBOX.Trash
* LIST (\HasNoChildren \Junk) "." INBOX.Junk
* LIST (\HasNoChildren \UnMarked \Sent) "." INBOX.Sent
* LIST (\HasNoChildren \Drafts) "." INBOX.Drafts
11 OK List completed (0.001 + 0.000 secs).

[INBOX]
[INBOX.Drafts]
[INBOX.Junk]
[INBOX.Sent]
[INBOX.Trash]

Folders mapping from --automap feature (use --f1f2 to override any mapping):
[INBOX.Sent]                             -> [INBOX.Sent]                            
[INBOX.Trash]                            -> [INBOX.Trash]                           
[INBOX.Drafts]                           -> [INBOX.Drafts]                          

Checking SEARCH ALL works on both accounts. To avoid that check, use --nochecknoabletosearch
Host1: checking if SEARCH ALL works on INBOX
Host1: folder [INBOX] has 97 messages mentioned by SELECT
Host1: folder [INBOX] has 97 messages found by SEARCH ALL
Host1: folder [INBOX] has the same messages count (97) by SELECT and SEARCH ALL
Host2: checking if SEARCH ALL works on INBOX
Host2: folder [INBOX] has 7 messages mentioned by SELECT
Host2: folder [INBOX] has 7 messages found by SEARCH ALL
Host2: folder [INBOX] has the same messages count (7) by SELECT and SEARCH ALL
Good! SEARCH ALL works on both accounts.

Folders sizes before the synchronization. It can take some time. Be patient.
You can remove foldersizes listings by using "--nofoldersizes" and "--nofoldersizesatend"
but then you will also lose the ETA (Estimation Time of Arrival) given after each message copy.
Host1 folder     1/5 [INBOX]                             Size:  20782662 Messages:    97 Biggest:   3670485
Host2 folder     1/5 [INBOX]                             Size:     53427 Messages:     7 Biggest:     21686
Host2-Host1                                                    -20729235             -90           -3648799

Host1 folder     2/5 [INBOX.Archive]                     Size:         0 Messages:     0 Biggest:         0
Host2 folder     2/5 [INBOX.Archive]                      does not exist yet
Host2-Host1                                                            0               0                  0

Host1 folder     3/5 [INBOX.Drafts]                      Size:      1329 Messages:     1 Biggest:      1329
Host2 folder     3/5 [INBOX.Drafts]                      Size:         0 Messages:     0 Biggest:         0
Host2-Host1                                                        -1329              -1              -1329

Host1 folder     4/5 [INBOX.Sent]                        Size:   3532706 Messages:     5 Biggest:   1201709
Host2 folder     4/5 [INBOX.Sent]                        Size:       838 Messages:     1 Biggest:       838
Host2-Host1                                                     -3531868              -4           -1200871

Host1 folder     5/5 [INBOX.Trash]                       Size:         0 Messages:     0 Biggest:         0
Host2 folder     5/5 [INBOX.Trash]                       Size:         0 Messages:     0 Biggest:         0
Host2-Host1                                                            0               0                  0

Host1 Nb folders:                     5 folders
Host2 Nb folders:                     5 folders

Host1 Nb messages:                  103 messages
Host2 Nb messages:                    8 messages

Host1 Total size:              24316697 bytes (23.190 MiB)
Host2 Total size:                 54265 bytes (52.993 KiB)

Host1 Biggest message:          3670485 bytes (3.500 MiB)
Host2 Biggest message:            21686 bytes (21.178 KiB)

Time spent on sizing:         7.1 seconds
++++ Looping on each one of 5 folders to sync
ETA: Tuesday 26 August 2025-08-26 15:17:40 -0400 -04  0 s  103/103 msgs left
Folder     1/5 [INBOX]                             -> [INBOX]                            
Host1: folder [INBOX] has 97 messages in total (mentioned by SELECT)
Host2: folder [INBOX] has 7 messages in total (mentioned by SELECT)
Host2: folder [INBOX] permanentflags: 
Host1: folder [INBOX] considering 97 messages
Host2: folder [INBOX] considering 7 messages
Host1: folder [INBOX] selected 97 messages, duplicates 0
Host2: folder [INBOX] selected 7 messages, duplicates 0
msg INBOX/1 {81001}           copied to INBOX/8          0.50 msgs/s  39.812 KiB/s 79.103 KiB copied ETA: Tuesday 26 August 2025-08-26 15:21:05 -0400 -04  203 s  102/103 msgs left
msg INBOX/2 {305598}          copied to INBOX/9          0.68 msgs/s  127.946 KiB/s 377.538 KiB copied ETA: Tuesday 26 August 2025-08-26 15:20:12 -0400 -04  149 s  101/103 msgs left
msg INBOX/3 {305421}          copied to INBOX/10         0.82 msgs/s  185.363 KiB/s 675.801 KiB copied ETA: Tuesday 26 August 2025-08-26 15:19:46 -0400 -04  122 s  100/103 msgs left
msg INBOX/4 {305374}          copied to INBOX/11         0.93 msgs/s  225.871 KiB/s 974.018 KiB copied ETA: Tuesday 26 August 2025-08-26 15:19:31 -0400 -04  107 s  99/103 msgs left
msg INBOX/5 {305350}          copied to INBOX/12         1.00 msgs/s  255.555 KiB/s 1.242 MiB copied ETA: Tuesday 26 August 2025-08-26 15:19:23 -0400 -04  98 s  98/103 msgs left
msg INBOX/6 {305393}          copied to INBOX/13         1.06 msgs/s  277.914 KiB/s 1.534 MiB copied ETA: Tuesday 26 August 2025-08-26 15:19:17 -0400 -04  91 s  97/103 msgs left
msg INBOX/7 {305659}          copied to INBOX/14         1.11 msgs/s  296.108 KiB/s 1.825 MiB copied ETA: Tuesday 26 August 2025-08-26 15:19:13 -0400 -04  87 s  96/103 msgs left
msg INBOX/8 {307051}          copied to INBOX/15         1.14 msgs/s  310.084 KiB/s 2.118 MiB copied ETA: Tuesday 26 August 2025-08-26 15:19:10 -0400 -04  83 s  95/103 msgs left
msg INBOX/9 {307054}          copied to INBOX/16         1.18 msgs/s  322.497 KiB/s 2.411 MiB copied ETA: Tuesday 26 August 2025-08-26 15:19:08 -0400 -04  80 s  94/103 msgs left
msg INBOX/10 {306158}         copied to INBOX/17         1.20 msgs/s  332.851 KiB/s 2.703 MiB copied ETA: Tuesday 26 August 2025-08-26 15:19:06 -0400 -04  77 s  93/103 msgs left
msg INBOX/11 {8628}           copied to INBOX/18         1.23 msgs/s  309.407 KiB/s 2.711 MiB copied ETA: Tuesday 26 August 2025-08-26 15:19:04 -0400 -04  75 s  92/103 msgs left
msg INBOX/12 {824349}         copied to INBOX/19         1.22 msgs/s  363.282 KiB/s 3.497 MiB copied ETA: Tuesday 26 August 2025-08-26 15:19:05 -0400 -04  75 s  91/103 msgs left
msg INBOX/13 {3876}           copied to INBOX/20         1.25 msgs/s  345.539 KiB/s 3.501 MiB copied ETA: Tuesday 26 August 2025-08-26 15:19:03 -0400 -04  72 s  90/103 msgs left
msg INBOX/14 {318290}         copied to INBOX/21         1.28 msgs/s  354.926 KiB/s 3.804 MiB copied ETA: Tuesday 26 August 2025-08-26 15:19:01 -0400 -04  70 s  89/103 msgs left
msg INBOX/15 {4983}           copied to INBOX/22         1.30 msgs/s  339.203 KiB/s 3.809 MiB copied ETA: Tuesday 26 August 2025-08-26 15:18:59 -0400 -04  67 s  88/103 msgs left
msg INBOX/16 {316798}         copied to INBOX/23         1.32 msgs/s  346.864 KiB/s 4.111 MiB copied ETA: Tuesday 26 August 2025-08-26 15:18:59 -0400 -04  66 s  87/103 msgs left
msg INBOX/17 {122564}         copied to INBOX/24         1.34 msgs/s  341.136 KiB/s 4.228 MiB copied ETA: Tuesday 26 August 2025-08-26 15:18:57 -0400 -04  64 s  86/103 msgs left
msg INBOX/18 {10798}          copied to INBOX/25         1.36 msgs/s  328.198 KiB/s 4.238 MiB copied ETA: Tuesday 26 August 2025-08-26 15:18:56 -0400 -04  62 s  85/103 msgs left
msg INBOX/19 {3670485}        copied to INBOX/26         1.30 msgs/s  540.456 KiB/s 7.739 MiB copied ETA: Tuesday 26 August 2025-08-26 15:19:00 -0400 -04  65 s  84/103 msgs left
msg INBOX/20 {45685}          copied to INBOX/27         1.32 msgs/s  524.549 KiB/s 7.782 MiB copied ETA: Tuesday 26 August 2025-08-26 15:18:59 -0400 -04  63 s  83/103 msgs left
msg INBOX/21 {4131}           copied to INBOX/28         1.34 msgs/s  507.496 KiB/s 7.786 MiB copied ETA: Tuesday 26 August 2025-08-26 15:18:57 -0400 -04  61 s  82/103 msgs left
msg INBOX/22 {4937}           copied to INBOX/29         1.35 msgs/s  491.211 KiB/s 7.791 MiB copied ETA: Tuesday 26 August 2025-08-26 15:18:56 -0400 -04  60 s  81/103 msgs left
msg INBOX/23 {4754}           copied to INBOX/30         1.37 msgs/s  476.265 KiB/s 7.796 MiB copied ETA: Tuesday 26 August 2025-08-26 15:18:55 -0400 -04  58 s  80/103 msgs left

Got a signal INT (my PID is 19181 my PPID is 14112)
Hit 2 ctr-c within 2 seconds to exit the program
Hit only 1 ctr-c to reconnect to both imap servers
For now only one signal INT within 2 seconds.
Info: reconnecting to host1 imap server patriciastocker.com
DEBUG: .../IO/Socket/SSL.pm:1177: global error: Undefined SSL object
DEBUG: .../IO/Socket/SSL.pm:1177: global error: Undefined SSL object
Info: reconnected to host1 imap server patriciastocker.com
Info: reconnecting to host2 imap server
DEBUG: .../IO/Socket/SSL.pm:1177: global error: Undefined SSL object
DEBUG: .../IO/Socket/SSL.pm:1177: global error: Undefined SSL object
Info: reconnected to host2 imap server imap.hostinger.com
Info: reconnected to both imap servers
DEBUG: .../IO/Socket/SSL.pm:1177: global error: Undefined SSL object
DEBUG: .../IO/Socket/SSL.pm:1177: global error: Undefined SSL object
msg INBOX/24 {103143}         copied to INBOX/32         1.17 msgs/s  393.641 KiB/s 7.894 MiB copied ETA: Tuesday 26 August 2025-08-26 15:19:09 -0400 -04  68 s  79/103 msgs left
msg INBOX/25 {19467}          copied to INBOX/33         1.19 msgs/s  384.270 KiB/s 7.913 MiB copied ETA: Tuesday 26 August 2025-08-26 15:19:07 -0400 -04  66 s  78/103 msgs left
msg INBOX/26 {16027}          copied to INBOX/34         1.20 msgs/s  375.150 KiB/s 7.928 MiB copied ETA: Tuesday 26 August 2025-08-26 15:19:06 -0400 -04  64 s  77/103 msgs left
msg INBOX/27 {16027}          copied to INBOX/35         1.22 msgs/s  366.623 KiB/s 7.943 MiB copied ETA: Tuesday 26 August 2025-08-26 15:19:05 -0400 -04  62 s  76/103 msgs left
msg INBOX/28 {16027}          copied to INBOX/36         1.23 msgs/s  358.340 KiB/s 7.958 MiB copied ETA: Tuesday 26 August 2025-08-26 15:19:04 -0400 -04  61 s  75/103 msgs left
msg INBOX/29 {16027}          copied to INBOX/37         1.24 msgs/s  350.016 KiB/s 7.974 MiB copied ETA: Tuesday 26 August 2025-08-26 15:19:03 -0400 -04  60 s  74/103 msgs left
msg INBOX/30 {16027}          copied to INBOX/38         1.26 msgs/s  342.535 KiB/s 7.989 MiB copied ETA: Tuesday 26 August 2025-08-26 15:19:02 -0400 -04  58 s  73/103 msgs left
msg INBOX/31 {16027}          copied to INBOX/39         1.27 msgs/s  335.139 KiB/s 8.004 MiB copied ETA: Tuesday 26 August 2025-08-26 15:19:02 -0400 -04  57 s  72/103 msgs left
msg INBOX/32 {16027}          copied to INBOX/40         1.27 msgs/s  325.864 KiB/s 8.020 MiB copied ETA: Tuesday 26 August 2025-08-26 15:19:01 -0400 -04  56 s  71/103 msgs left

Got a signal INT (my PID is 19181 my PPID is 14112)
Hit 2 ctr-c within 2 seconds to exit the program
Hit only 1 ctr-c to reconnect to both imap servers
For now only one signal INT within 2 seconds.
Info: reconnecting to host1 imap server patriciastocker.com
DEBUG: .../IO/Socket/SSL.pm:1177: global error: Undefined SSL object
DEBUG: .../IO/Socket/SSL.pm:1177: global error: Undefined SSL object
Info: reconnected to host1 imap server patriciastocker.com
Info: reconnecting to host2 imap server
DEBUG: .../IO/Socket/SSL.pm:1177: global error: Undefined SSL object
DEBUG: .../IO/Socket/SSL.pm:1177: global error: Undefined SSL object
Info: reconnected to host2 imap server imap.hostinger.com
Info: reconnected to both imap servers
DEBUG: .../IO/Socket/SSL.pm:1177: global error: Undefined SSL object
DEBUG: .../IO/Socket/SSL.pm:1177: global error: Undefined SSL object
msg INBOX/33 {16027}          copied to INBOX/41         1.15 msgs/s  287.001 KiB/s 8.035 MiB copied ETA: Tuesday 26 August 2025-08-26 15:19:10 -0400 -04  61 s  70/103 msgs left
msg INBOX/34 {42465}          copied to INBOX/42         1.16 msgs/s  281.958 KiB/s 8.075 MiB copied ETA: Tuesday 26 August 2025-08-26 15:19:09 -0400 -04  60 s  69/103 msgs left
msg INBOX/35 {16027}          copied to INBOX/43         1.16 msgs/s  275.348 KiB/s 8.091 MiB copied ETA: Tuesday 26 August 2025-08-26 15:19:09 -0400 -04  58 s  68/103 msgs left
msg INBOX/36 {16027}          copied to INBOX/44         1.17 msgs/s  270.173 KiB/s 8.106 MiB copied ETA: Tuesday 26 August 2025-08-26 15:19:08 -0400 -04  57 s  67/103 msgs left
msg INBOX/37 {11175}          copied to INBOX/45         1.18 msgs/s  265.115 KiB/s 8.117 MiB copied ETA: Tuesday 26 August 2025-08-26 15:19:08 -0400 -04  56 s  66/103 msgs left
msg INBOX/38 {16027}          copied to INBOX/46         1.19 msgs/s  259.957 KiB/s 8.132 MiB copied ETA: Tuesday 26 August 2025-08-26 15:19:07 -0400 -04  55 s  65/103 msgs left
msg INBOX/39 {16027}          copied to INBOX/47         1.19 msgs/s  255.234 KiB/s 8.147 MiB copied ETA: Tuesday 26 August 2025-08-26 15:19:07 -0400 -04  54 s  64/103 msgs left
msg INBOX/40 {13621}          copied to INBOX/48         1.20 msgs/s  250.741 KiB/s 8.160 MiB copied ETA: Tuesday 26 August 2025-08-26 15:19:06 -0400 -04  52 s  63/103 msgs left
msg INBOX/41 {32949}          copied to INBOX/49         1.21 msgs/s  246.871 KiB/s 8.192 MiB copied ETA: Tuesday 26 August 2025-08-26 15:19:06 -0400 -04  51 s  62/103 msgs left
msg INBOX/42 {29690}          copied to INBOX/50         1.21 msgs/s  243.048 KiB/s 8.220 MiB copied ETA: Tuesday 26 August 2025-08-26 15:19:05 -0400 -04  50 s  61/103 msgs left
msg INBOX/43 {43079}          copied to INBOX/51         1.22 msgs/s  239.585 KiB/s 8.261 MiB copied ETA: Tuesday 26 August 2025-08-26 15:19:05 -0400 -04  49 s  60/103 msgs left
msg INBOX/44 {46898}          copied to INBOX/52         1.22 msgs/s  236.267 KiB/s 8.306 MiB copied ETA: Tuesday 26 August 2025-08-26 15:19:05 -0400 -04  48 s  59/103 msgs left
msg INBOX/45 {15579}          copied to INBOX/53         1.23 msgs/s  232.558 KiB/s 8.321 MiB copied ETA: Tuesday 26 August 2025-08-26 15:19:04 -0400 -04  47 s  58/103 msgs left
msg INBOX/46 {4309}           copied to INBOX/54         1.23 msgs/s  228.828 KiB/s 8.325 MiB copied ETA: Tuesday 26 August 2025-08-26 15:19:04 -0400 -04  46 s  57/103 msgs left
msg INBOX/47 {10244}          copied to INBOX/55         1.24 msgs/s  224.746 KiB/s 8.334 MiB copied ETA: Tuesday 26 August 2025-08-26 15:19:04 -0400 -04  45 s  56/103 msgs left
msg INBOX/48 {3149}           copied to INBOX/56         1.24 msgs/s  221.088 KiB/s 8.337 MiB copied ETA: Tuesday 26 August 2025-08-26 15:19:03 -0400 -04  44 s  55/103 msgs left
msg INBOX/49 {978623}         copied to INBOX/57         1.23 msgs/s  238.951 KiB/s 9.271 MiB copied ETA: Tuesday 26 August 2025-08-26 15:19:04 -0400 -04  44 s  54/103 msgs left
msg INBOX/50 {327692}         copied to INBOX/58         1.23 msgs/s  242.361 KiB/s 9.583 MiB copied ETA: Tuesday 26 August 2025-08-26 15:19:04 -0400 -04  43 s  53/103 msgs left
msg INBOX/51 {123210}         copied to INBOX/59         1.24 msgs/s  241.454 KiB/s 9.701 MiB copied ETA: Tuesday 26 August 2025-08-26 15:19:03 -0400 -04  42 s  52/103 msgs left
msg INBOX/52 {13145}          copied to INBOX/60         1.24 msgs/s  238.094 KiB/s 9.713 MiB copied ETA: Tuesday 26 August 2025-08-26 15:19:03 -0400 -04  41 s  51/103 msgs left
msg INBOX/53 {962200}         copied to INBOX/61         1.24 msgs/s  255.475 KiB/s 10.631 MiB copied ETA: Tuesday 26 August 2025-08-26 15:19:03 -0400 -04  40 s  50/103 msgs left
msg INBOX/54 {3441}           copied to INBOX/62         1.25 msgs/s  251.791 KiB/s 10.634 MiB copied ETA: Tuesday 26 August 2025-08-26 15:19:03 -0400 -04  39 s  49/103 msgs left
msg INBOX/55 {28445}          copied to INBOX/63         1.25 msgs/s  248.780 KiB/s 10.661 MiB copied ETA: Tuesday 26 August 2025-08-26 15:19:03 -0400 -04  38 s  48/103 msgs left
msg INBOX/56 {18963}          copied to INBOX/64         1.26 msgs/s  245.640 KiB/s 10.679 MiB copied ETA: Tuesday 26 August 2025-08-26 15:19:02 -0400 -04  37 s  47/103 msgs left
msg INBOX/57 {4149}           copied to INBOX/65         1.26 msgs/s  242.366 KiB/s 10.683 MiB copied ETA: Tuesday 26 August 2025-08-26 15:19:02 -0400 -04  36 s  46/103 msgs left
msg INBOX/58 {11273}          copied to INBOX/66         1.27 msgs/s  239.326 KiB/s 10.694 MiB copied ETA: Tuesday 26 August 2025-08-26 15:19:02 -0400 -04  36 s  45/103 msgs left
msg INBOX/59 {949107}         copied to INBOX/67         1.26 msgs/s  254.068 KiB/s 11.599 MiB copied ETA: Tuesday 26 August 2025-08-26 15:19:02 -0400 -04  35 s  44/103 msgs left
msg INBOX/60 {3121}           copied to INBOX/68         1.27 msgs/s  250.695 KiB/s 11.602 MiB copied ETA: Tuesday 26 August 2025-08-26 15:19:02 -0400 -04  34 s  43/103 msgs left
msg INBOX/61 {3662}           copied to INBOX/69         1.27 msgs/s  247.550 KiB/s 11.606 MiB copied ETA: Tuesday 26 August 2025-08-26 15:19:01 -0400 -04  33 s  42/103 msgs left
msg INBOX/62 {1192405}        copied to INBOX/70         1.26 msgs/s  264.884 KiB/s 12.743 MiB copied ETA: Tuesday 26 August 2025-08-26 15:19:02 -0400 -04  33 s  41/103 msgs left
msg INBOX/63 {47641}          copied to INBOX/71         1.26 msgs/s  261.628 KiB/s 12.788 MiB copied ETA: Tuesday 26 August 2025-08-26 15:19:02 -0400 -04  32 s  40/103 msgs left
msg INBOX/64 {5196}           copied to INBOX/72         1.26 msgs/s  258.498 KiB/s 12.793 MiB copied ETA: Tuesday 26 August 2025-08-26 15:19:02 -0400 -04  31 s  39/103 msgs left
msg INBOX/65 {1003715}        copied to INBOX/73         1.26 msgs/s  272.704 KiB/s 13.750 MiB copied ETA: Tuesday 26 August 2025-08-26 15:19:02 -0400 -04  30 s  38/103 msgs left
msg INBOX/66 {615347}         copied to INBOX/74         1.26 msgs/s  279.839 KiB/s 14.337 MiB copied ETA: Tuesday 26 August 2025-08-26 15:19:02 -0400 -04  29 s  37/103 msgs left
msg INBOX/67 {18738}          copied to INBOX/75         1.26 msgs/s  276.892 KiB/s 14.355 MiB copied ETA: Tuesday 26 August 2025-08-26 15:19:02 -0400 -04  29 s  36/103 msgs left
msg INBOX/68 {3907}           copied to INBOX/76         1.26 msgs/s  273.300 KiB/s 14.359 MiB copied ETA: Tuesday 26 August 2025-08-26 15:19:02 -0400 -04  28 s  35/103 msgs left
msg INBOX/69 {1205962}        copied to INBOX/77         1.26 msgs/s  288.971 KiB/s 15.509 MiB copied ETA: Tuesday 26 August 2025-08-26 15:19:02 -0400 -04  27 s  34/103 msgs left
msg INBOX/70 {3197}           copied to INBOX/78         1.26 msgs/s  285.831 KiB/s 15.512 MiB copied ETA: Tuesday 26 August 2025-08-26 15:19:02 -0400 -04  26 s  33/103 msgs left
msg INBOX/71 {349251}         copied to INBOX/79         1.26 msgs/s  288.101 KiB/s 15.845 MiB copied ETA: Tuesday 26 August 2025-08-26 15:19:02 -0400 -04  25 s  32/103 msgs left
msg INBOX/72 {4653}           copied to INBOX/80         1.26 msgs/s  285.056 KiB/s 15.850 MiB copied ETA: Tuesday 26 August 2025-08-26 15:19:02 -0400 -04  25 s  31/103 msgs left
msg INBOX/73 {185612}         copied to INBOX/81         1.27 msgs/s  284.760 KiB/s 16.027 MiB copied ETA: Tuesday 26 August 2025-08-26 15:19:02 -0400 -04  24 s  30/103 msgs left
msg INBOX/74 {621530}         copied to INBOX/82         1.27 msgs/s  291.079 KiB/s 16.619 MiB copied ETA: Tuesday 26 August 2025-08-26 15:19:02 -0400 -04  23 s  29/103 msgs left
msg INBOX/75 {1031712}        copied to INBOX/83         1.26 msgs/s  303.234 KiB/s 17.603 MiB copied ETA: Tuesday 26 August 2025-08-26 15:19:02 -0400 -04  22 s  28/103 msgs left
msg INBOX/76 {3170}           copied to INBOX/84         1.27 msgs/s  300.134 KiB/s 17.606 MiB copied ETA: Tuesday 26 August 2025-08-26 15:19:02 -0400 -04  21 s  27/103 msgs left
msg INBOX/77 {469128}         copied to INBOX/85         1.27 msgs/s  303.863 KiB/s 18.054 MiB copied ETA: Tuesday 26 August 2025-08-26 15:19:02 -0400 -04  21 s  26/103 msgs left
msg INBOX/78 {13197}          copied to INBOX/86         1.27 msgs/s  300.968 KiB/s 18.066 MiB copied ETA: Tuesday 26 August 2025-08-26 15:19:02 -0400 -04  20 s  25/103 msgs left
msg INBOX/79 {1043188}        copied to INBOX/87         1.26 msgs/s  312.174 KiB/s 19.061 MiB copied ETA: Tuesday 26 August 2025-08-26 15:19:02 -0400 -04  19 s  24/103 msgs left
msg INBOX/80 {52028}          copied to INBOX/88         1.27 msgs/s  309.854 KiB/s 19.111 MiB copied ETA: Tuesday 26 August 2025-08-26 15:19:02 -0400 -04  18 s  23/103 msgs left
msg INBOX/81 {7972}           copied to INBOX/89         1.27 msgs/s  306.946 KiB/s 19.118 MiB copied ETA: Tuesday 26 August 2025-08-26 15:19:01 -0400 -04  17 s  22/103 msgs left
msg INBOX/82 {240041}         copied to INBOX/90         1.27 msgs/s  307.305 KiB/s 19.347 MiB copied ETA: Tuesday 26 August 2025-08-26 15:19:01 -0400 -04  17 s  21/103 msgs left
msg INBOX/83 {92717}          copied to INBOX/91         1.27 msgs/s  305.665 KiB/s 19.436 MiB copied ETA: Tuesday 26 August 2025-08-26 15:19:01 -0400 -04  16 s  20/103 msgs left
msg INBOX/84 {14177}          copied to INBOX/92         1.28 msgs/s  302.973 KiB/s 19.449 MiB copied ETA: Tuesday 26 August 2025-08-26 15:19:01 -0400 -04  15 s  19/103 msgs left
msg INBOX/85 {28234}          copied to INBOX/93         1.28 msgs/s  300.508 KiB/s 19.476 MiB copied ETA: Tuesday 26 August 2025-08-26 15:19:01 -0400 -04  14 s  18/103 msgs left
msg INBOX/86 {318348}         copied to INBOX/94         1.28 msgs/s  302.025 KiB/s 19.780 MiB copied ETA: Tuesday 26 August 2025-08-26 15:19:01 -0400 -04  13 s  17/103 msgs left
msg INBOX/87 {3812}           copied to INBOX/95         1.29 msgs/s  299.309 KiB/s 19.783 MiB copied ETA: Tuesday 26 August 2025-08-26 15:19:01 -0400 -04  12 s  16/103 msgs left
msg INBOX/88 {3815}           copied to INBOX/96         1.29 msgs/s  296.621 KiB/s 19.787 MiB copied ETA: Tuesday 26 August 2025-08-26 15:19:00 -0400 -04  12 s  15/103 msgs left
msg INBOX/89 {3836}           copied to INBOX/97         1.29 msgs/s  293.998 KiB/s 19.791 MiB copied ETA: Tuesday 26 August 2025-08-26 15:19:00 -0400 -04  11 s  14/103 msgs left
msg INBOX/90 {3811}           copied to INBOX/98         1.29 msgs/s  290.828 KiB/s 19.794 MiB copied ETA: Tuesday 26 August 2025-08-26 15:19:00 -0400 -04  10 s  13/103 msgs left
msg INBOX/91 {3810}           copied to INBOX/99         1.29 msgs/s  288.297 KiB/s 19.798 MiB copied ETA: Tuesday 26 August 2025-08-26 15:19:00 -0400 -04  9 s  12/103 msgs left
msg INBOX/92 {3822}           copied to INBOX/100        1.30 msgs/s  285.841 KiB/s 19.802 MiB copied ETA: Tuesday 26 August 2025-08-26 15:19:00 -0400 -04  8 s  11/103 msgs left
msg INBOX/93 {3822}           copied to INBOX/101        1.30 msgs/s  283.408 KiB/s 19.805 MiB copied ETA: Tuesday 26 August 2025-08-26 15:19:00 -0400 -04  8 s  10/103 msgs left
msg INBOX/94 {3844}           copied to INBOX/102        1.30 msgs/s  281.045 KiB/s 19.809 MiB copied ETA: Tuesday 26 August 2025-08-26 15:18:59 -0400 -04  7 s  9/103 msgs left
msg INBOX/95 {3812}           copied to INBOX/103        1.30 msgs/s  278.673 KiB/s 19.812 MiB copied ETA: Tuesday 26 August 2025-08-26 15:18:59 -0400 -04  6 s  8/103 msgs left
msg INBOX/96 {3880}           copied to INBOX/104        1.31 msgs/s  276.391 KiB/s 19.816 MiB copied ETA: Tuesday 26 August 2025-08-26 15:18:59 -0400 -04  5 s  7/103 msgs left
msg INBOX/97 {3872}           copied to INBOX/105        1.31 msgs/s  274.147 KiB/s 19.820 MiB copied ETA: Tuesday 26 August 2025-08-26 15:18:59 -0400 -04  5 s  6/103 msgs left
ETA: Tuesday 26 August 2025-08-26 15:18:59 -0400 -04  5 s  6/103 msgs left
Folder     2/5 [INBOX.Archive]                     -> [INBOX.Archive]                    
Host1: folder [INBOX.Archive] has 0 messages in total (mentioned by SELECT)
Creating folder [INBOX.Archive] on host2
Created folder [INBOX.Archive] on host2
Host2: folder [INBOX.Archive] has 0 messages in total (mentioned by SELECT)
Host2: folder [INBOX.Archive] permanentflags: 
Host2: Subscribing to folder INBOX.Archive
Host1: folder [INBOX.Archive] considering 0 messages
Host2: folder [INBOX.Archive] considering 0 messages
Host1: folder [INBOX.Archive] selected 0 messages, duplicates 0
Host2: folder [INBOX.Archive] selected 0 messages, duplicates 0
ETA: Tuesday 26 August 2025-08-26 15:19:01 -0400 -04  5 s  6/103 msgs left
Folder     3/5 [INBOX.Drafts]                      -> [INBOX.Drafts]                     
Host1: folder [INBOX.Drafts] has 1 messages in total (mentioned by SELECT)
Host2: folder [INBOX.Drafts] has 0 messages in total (mentioned by SELECT)
Host2: folder [INBOX.Drafts] permanentflags: 
Host1: folder [INBOX.Drafts] considering 1 messages
Host2: folder [INBOX.Drafts] considering 0 messages
Host1: folder [INBOX.Drafts] selected 1 messages, duplicates 0
Host2: folder [INBOX.Drafts] selected 0 messages, duplicates 0
msg INBOX.Drafts/1 {1329}            copied to INBOX.Drafts/1          1.27 msgs/s  262.321 KiB/s 19.821 MiB copied ETA: Tuesday 26 August 2025-08-26 15:19:02 -0400 -04  4 s  5/103 msgs left
ETA: Tuesday 26 August 2025-08-26 15:19:02 -0400 -04  4 s  5/103 msgs left
Folder     4/5 [INBOX.Sent]                        -> [INBOX.Sent]                       
Host1: folder [INBOX.Sent] has 5 messages in total (mentioned by SELECT)
Host2: folder [INBOX.Sent] has 1 messages in total (mentioned by SELECT)
Host2: folder [INBOX.Sent] permanentflags: 
Host1: folder [INBOX.Sent] considering 5 messages
Host2: folder [INBOX.Sent] considering 1 messages
Host1: folder [INBOX.Sent] selected 5 messages, duplicates 0
Host2: folder [INBOX.Sent] selected 1 messages, duplicates 0
msg INBOX.Sent/1 {936493}          copied to INBOX.Sent/2          1.24 msgs/s  265.017 KiB/s 20.714 MiB copied ETA: Tuesday 26 August 2025-08-26 15:19:04 -0400 -04  3 s  4/103 msgs left
msg INBOX.Sent/2 {1201709}         copied to INBOX.Sent/3          1.23 msgs/s  276.370 KiB/s 21.860 MiB copied ETA: Tuesday 26 August 2025-08-26 15:19:04 -0400 -04  2 s  3/103 msgs left
msg INBOX.Sent/3 {2344}            copied to INBOX.Sent/4          1.24 msgs/s  274.320 KiB/s 21.863 MiB copied ETA: Tuesday 26 August 2025-08-26 15:19:04 -0400 -04  2 s  2/103 msgs left
msg INBOX.Sent/4 {936246}          copied to INBOX.Sent/5          1.24 msgs/s  282.623 KiB/s 22.755 MiB copied ETA: Tuesday 26 August 2025-08-26 15:19:04 -0400 -04  1 s  1/103 msgs left
msg INBOX.Sent/5 {455914}          copied to INBOX.Sent/6          1.24 msgs/s  285.458 KiB/s 23.190 MiB copied ETA: Tuesday 26 August 2025-08-26 15:19:04 -0400 -04  0 s  0/103 msgs left
ETA: Tuesday 26 August 2025-08-26 15:19:04 -0400 -04  0 s  0/103 msgs left
Folder     5/5 [INBOX.Trash]                       -> [INBOX.Trash]                      
Host1: folder [INBOX.Trash] has 0 messages in total (mentioned by SELECT)
Host2: folder [INBOX.Trash] has 0 messages in total (mentioned by SELECT)
Host2: folder [INBOX.Trash] permanentflags: 
Host1: folder [INBOX.Trash] considering 0 messages
Host2: folder [INBOX.Trash] considering 0 messages
Host1: folder [INBOX.Trash] selected 0 messages, duplicates 0
Host2: folder [INBOX.Trash] selected 0 messages, duplicates 0
ETA: Tuesday 26 August 2025-08-26 15:19:04 -0400 -04  0 s  0/103 msgs left
++++ End looping on each folder

Folders sizes after the synchronization.
You can remove this foldersizes listing by using  "--nofoldersizesatend"
Host1 folder     1/5 [INBOX]                             Size:  20782662 Messages:    97 Biggest:   3670485
Host2 folder     1/5 [INBOX]                             Size:  20939232 Messages:   105 Biggest:   3670485
Host2-Host1                                                       156570               8                  0

Host1 folder     2/5 [INBOX.Archive]                     Size:         0 Messages:     0 Biggest:         0
Host2 folder     2/5 [INBOX.Archive]                     Size:         0 Messages:     0 Biggest:         0
Host2-Host1                                                            0               0                  0

Host1 folder     3/5 [INBOX.Drafts]                      Size:      1329 Messages:     1 Biggest:      1329
Host2 folder     3/5 [INBOX.Drafts]                      Size:      1329 Messages:     1 Biggest:      1329
Host2-Host1                                                            0               0                  0

Host1 folder     4/5 [INBOX.Sent]                        Size:   3532706 Messages:     5 Biggest:   1201709
Host2 folder     4/5 [INBOX.Sent]                        Size:   3533544 Messages:     6 Biggest:   1201709
Host2-Host1                                                          838               1                  0

Host1 folder     5/5 [INBOX.Trash]                       Size:         0 Messages:     0 Biggest:         0
Host2 folder     5/5 [INBOX.Trash]                       Size:         0 Messages:     0 Biggest:         0
Host2-Host1                                                            0               0                  0

Host1 Nb folders:                     5 folders
Host2 Nb folders:                     5 folders

Host1 Nb messages:                  103 messages
Host2 Nb messages:                  112 messages

Host1 Total size:              24316697 bytes (23.190 MiB)
Host2 Total size:              24474105 bytes (23.340 MiB)

Host1 Biggest message:          3670485 bytes (3.500 MiB)
Host2 Biggest message:          3670485 bytes (3.500 MiB)

Time spent on sizing:         3.8 seconds
++++ Statistics
Transfer started on                     : Tuesday 26 August 2025-08-26 15:17:33 -0400 -04
Transfer ended on                       : Tuesday 26 August 2025-08-26 15:19:08 -0400 -04
Transfer time                           : 94.9 sec
Folders synced                          : 5/5 synced
Folders deleted on host2                : 0 
Messages transferred                    : 103 
Messages skipped                        : 0
Messages found duplicate on host1       : 0
Messages found duplicate on host2       : 0
Messages found crossduplicate on host2  : 0
Messages void (noheader) on host1       : 0  
Messages void (noheader) on host2       : 0
Messages found in host1 not in host2    : 0 messages
Messages found in host2 not in host1    : 8 messages
Messages deleted on host1               : 0
Messages deleted on host2               : 0
Total bytes transferred                 : 24316697 (23.190 MiB)
Total bytes skipped                     : 0 (0.000 KiB)
Message rate                            : 1.1 messages/s
Average bandwidth rate                  : 250.3 KiB/s
Reconnections to host1                  : 2
Reconnections to host2                  : 2
Memory consumption at the end           : 63.3 MiB (*time 1.7 MiB*h) (started with 154.2 MiB)
Load end is                             : 2.14 2.23 2.53 on 8 cores
CPU time and %cpu                       : 2.36 sec 2.5 %cpu 0.3 %allcpus
Biggest message transferred             : 3670485 bytes (3.500 MiB)
Memory/biggest message ratio            : 18.1
Start difference host2 - host1          : -95 messages, -24262432 bytes (-23.138 MiB)
Final difference host2 - host1          : 9 messages, 157408 bytes (153.719 KiB)
The sync looks good, all 103 identified messages in host1 are on host2.
There is no unidentified message on host1.
The sync is not strict, there are 8 among 111 identified messages in host2 that are not on host1. Use --delete2 and sync again to delete them and have a strict sync.
Detected 0 errors
This imapsync is up to date. ( local 2.290 >= official 2.290 )( Use --noreleasecheck to avoid this release check. )
Homepage: https://imapsync.lamiral.info/
Exiting with return value 0 (EX_OK: successful termination) 0/50 nb_errors/max_errors PID 19181
Removing pidfile /Users/a1234/tmp/imapsync.pid
Log file is LOG_imapsync/2025_08_26_15_17_33_800_tomas_patriciastocker_com_tomas_patriciastocker_com.txt ( to change it, use --logfile filepath ; or use --nolog to turn off logging )
